{
  "schemaVersion": "0.1.0",
  "project": { "id": "conflict", "name": "Conflict", "version": "0.1.0" },
  "minecraft": { "version": "1.20.1" },
  "loader": { "type": "forge", "version": "47.2.20" },
  "java": { "major": 17 },
  "profiles": [ { "id": "client", "name": "Client", "side": "client" } ],
  "mods": [
    {
      "id": "embeddium",
      "name": "Embeddium",
      "source": { "type": "modrinth", "projectId": "embeddium" },
      "version": "0.3.31",
      "side": "client",
      "dependencies": []
    },
    {
      "id": "rubidium",
      "name": "Rubidium",
      "source": { "type": "local", "path": "mods/rubidium.jar" },
      "version": "0.7.1",
      "side": "client",
      "dependencies": [
        { "type": "conflicts", "target": "embeddium", "reason": "Both replace the rendering pipeline" }
      ]
    }
  ]
}
