{
  "schemaVersion": "0.1.0",
  "project": { "id": "missing-dep", "name": "Missing Dep", "version": "0.1.0" },
  "minecraft": { "version": "1.20.1" },
  "loader": { "type": "fabric", "version": "0.15.11" },
  "java": { "major": 17 },
  "profiles": [ { "id": "client", "name": "Client", "side": "client" } ],
  "mods": [
    {
      "id": "kubejs",
      "name": "KubeJS",
      "source": { "type": "modrinth", "projectId": "kubejs" },
      "version": "2001.6.5",
      "side": "both",
      "dependencies": [ { "type": "requires", "target": "rhino", "versionConstraint": ">=2001" } ]
    }
  ]
}
